Url,Title,Author,Rate,Ratings,Year,Abstract,Genre
/book/show/32620332-the-seven-husbands-of-evelyn-hugo,The Seven Husbands of Evelyn Hugo,Taylor_Jenkins_Reid,4.47,"799,447",2017,"'Aging and reclusive Hollywood movie icon Evelyn Hugo is finally ready to tell the truth about her glamorous and scandalous life. But when she chooses unknown magazine reporter Monique Grant for the job, no one is more astounded than Monique herself. Why her? Why now?nnMonique is not exactly on top of the world. Her husband has left her, and her professional life is going nowhere. Regardless of why Evelyn has selected her to write her biography, Monique is determined to use this opportunity to jumpstart her career.nnSummoned to Evelyn’s luxurious apartment, Monique listens in fascination as the actress tells her story. From making her way to Los Angeles in the 1950s to her decision to leave show business in the ‘80s, and, of course, the seven husbands along the way, Evelyn unspools a tale of ruthless ambition, unexpected friendship, and a great forbidden love. Monique begins to feel a very real connection to the legendary star, but as Evelyn’s story near its conclusion, it becomes clear that her life intersects with Monique’s own in tragic and irreversible ways.'",Historical Fiction
/book/show/55404546-malibu-rising,Malibu Rising,Taylor_Jenkins_Reid,4.10,"310,740",2021,"'Four famous siblings throw an epic party to celebrate the end of the summer. But over the course of twenty-four hours, their lives will change forever. nnMalibu: August, 1983. It’s the day of Nina Riva’s annual end-of-summer party, and anticipation is at a fever pitch. Everyone wants to be around the famous Rivas: Nina, the talented surfer and supermodel; brothers Jay and Hud, one a championship surfer, the other a renowned photographer; and their adored baby sister, Kit. Together, the siblings are a source of fascination in Malibu and the world over—especially as the offspring of the legendary singer, Mick Riva.nnThe only person not looking forward to the party of the year is Nina herself, who never wanted to be the center of attention, and who has also just been very publicly abandoned by her pro tennis player husband. Oh, and maybe Hud—because it is long past time to confess something to the brother from whom he’s been inseparable since birth.nnJay, on the other hand, is counting the minutes until nightfall, when the girl he can’t stop thinking about promised she’ll be there.nnAnd Kit has a couple secrets of her own—including a guest she invited without consulting anyone.nnBy midnight the party will be completely out of control. By morning, the Riva mansion will have gone up in flames. But before that first spark in the early hours before dawn, the alcohol will flow, the music will play, and the loves and secrets that shaped this family’s generations will all come bubbling to the surface.nnMalibu Rising is a story about one unforgettable night in the life of a family: the night they each have to choose what they will keep from the people who made them... and what they will leave behind.'",Historical Fiction
/book/show/50623864-the-invisible-life-of-addie-larue,The Invisible Life of Addie LaRue,V_E_Schwab,4.24,"490,893",2020,"'A Life No One Will Remember. A Story You Will Never Forget.nnFrance, 1714: in a moment of desperation, a young woman makes a Faustian bargain to live forever and is cursed to be forgotten by everyone she meets.nnThus begins the extraordinary life of Addie LaRue, and a dazzling adventure that will play out across centuries and continents, across history and art, as a young woman learns how far she will go to leave her mark on the world.nnBut everything changes when, after nearly 300 years, Addie stumbles across a young man in a hidden bookstore and he remembers her name.'",Historical Fiction
/book/show/53288434-the-lost-apothecary,The Lost Apothecary,Sarah_Penner,3.78,"157,454",2021,"'A female apothecary secretly dispenses poisons to liberate women from the men who have wronged them - setting three lives across centuries on a dangerous collision course. nnRule #1: The poison must never be used to harm another woman.nRule #2: The names of the murderer and her victim must be recorded in the apothecary’s register.nnOne cold February evening in 1791, at the back of a dark London alley in a hidden apothecary shop, Nella awaits her newest customer. Once a respected healer, Nella now uses her knowledge for a darker purpose - selling well-disguised poisons to desperate women who would kill to be free of the men in their lives. But when her new patron turns out to be a precocious twelve-year-old named Eliza Fanning, an unexpected friendship sets in motion a string of events that jeopardizes Nella’s world and threatens to expose the many women whose names are written in her register.nnIn present-day London, aspiring historian Caroline Parcewell spends her tenth wedding anniversary alone, reeling from the discovery of her husband’s infidelity. When she finds an old apothecary vial near the river Thames, she can’t resist investigating, only to realize she’s found a link to the unsolved “apothecary murders” that haunted London over two centuries ago. As she deepens her search, Caroline’s life collides with Nella’s and Eliza’s in a stunning twist of fate - and not everyone will survive.'",Historical Fiction
/book/show/55929774-these-tangled-vines,These Tangled Vines,Julianne_MacLean,4.27,"37,925",2021,"'From the USA Today bestselling author of A Curve in the Road comes a sweeping and captivating tale of one woman’s journey to the lush vineyards of Tuscany—and into the mysteries of a tragic family secret.nnIf Fiona has learned anything in life, it’s how to keep a secret—even from the father who raised her. She is the only person who knows about her late mother’s affair in Tuscany thirty years earlier, and she intends to keep it that way…until a lawyer calls with shocking news: her biological father has died and left her an incredible inheritance—along with two half siblings.nnFiona travels to Italy, where the family is shocked to learn of her existence and desperate to contest her share of the will. While the mystery of her mother’s affair is slowly unraveled, Fiona must navigate through tricky family relationships and tense sibling rivalries. Fiona both fears and embraces her new destiny as she searches for the truth about the fateful summer her mother spent in Italy and the father she never knew.nnSpilling over with the sumptuous flavors and romance of Tuscany, These Tangled Vines takes readers on a breathtaking journey of love, secrets, sacrifice, courage—and most importantly, the true meaning of family.'",Historical Fiction
/book/show/35959740-circe,Circe,Madeline_Miller,4.26,"598,890",2018,"'In the house of Helios, god of the sun and mightiest of the Titans, a daughter is born. But Circe is a strange child - not powerful, like her father, nor viciously alluring like her mother. Turning to the world of mortals for companionship, she discovers that she does possess power - the power of witchcraft, which can transform rivals into monsters and menace the gods themselves.nnThreatened, Zeus banishes her to a deserted island, where she hones her occult craft, tames wild beasts and crosses paths with many of the most famous figures in all of mythology, including the Minotaur, Daedalus and his doomed son Icarus, the murderous Medea, and, of course, wily Odysseus.nnBut there is danger, too, for a woman who stands alone, and Circe unwittingly draws the wrath of both men and gods, ultimately finding herself pitted against one of the most terrifying and vengeful of the Olympians. To protect what she loves most, Circe must summon all her strength and choose, once and for all, whether she belongs with the gods she is born from, or the mortals she has come to love.'",Historical Fiction
/book/show/56783258-cloud-cuckoo-land,Cloud Cuckoo Land,Anthony_Doerr,4.32,"42,368",2021,"'Thirteen-year-old Anna, an orphan, lives inside the formidable walls of Constantinople in a house of women who make their living embroidering the robes of priests. Restless, insatiably curious, Anna learns to read, and in this ancient city, famous for its libraries, she finds a book, the story of Aethon, who longs to be turned into a bird so that he can fly to a utopian paradise in the sky. This she reads to her ailing sister as the walls of the only place she has known are bombarded in the great siege of Constantinople. Outside the walls is Omeir, a village boy, miles from home, conscripted with his beloved oxen into the invading army. His path and Anna’s will cross.nnFive hundred years later, in a library in Idaho, octogenarian Zeno, who learned Greek as a prisoner of war, rehearses five children in a play adaptation of Aethon’s story, preserved against all odds through centuries. Tucked among the library shelves is a bomb, planted by a troubled, idealistic teenager, Seymour. This is another siege. And in a not-so-distant future, on the interstellar ship Argos, Konstance is alone in a vault, copying on scraps of sacking the story of Aethon, told to her by her father. She has never set foot on our planet.'",Historical Fiction
/book/show/38359036-the-tattooist-of-auschwitz,"The Tattooist of Auschwitz (The Tattooist of Auschwitz, #1)",Heather_Morris,4.27,"648,916",2018,"""In April 1942, Lale Sokolov, a Slovakian Jew, is forcibly transported to the concentration camps at Auschwitz-Birkenau. When his captors discover that he speaks several languages, he is put to work as a Tätowierer (the German word for tattooist), tasked with permanently marking his fellow prisoners.nnImprisoned for more than two and a half years, Lale witnesses horrific atrocities and barbarism—but also incredible acts of bravery and compassion. Risking his own life, he uses his privileged position to exchange jewels and money from murdered Jews for food to keep his fellow prisoners alive.nnOne day in July 1942, Lale, prisoner 32407, comforts a trembling young woman waiting in line to have the number 34902 tattooed onto her arm. Her name is Gita, and in that first encounter, Lale vows to somehow survive the camp and marry her.nnA vivid, harrowing, and ultimately hopeful re-creation of Lale Sokolov's experiences as the man who tattooed the arms of thousands of prisoners with what would become one of the most potent symbols of the Holocaust, The Tattooist of Auschwitz is also a testament to the endurance of love and humanity under the darkest possible conditions.""",Historical Fiction
/book/show/57827618-the-lobotomist-s-wife,The Lobotomist's Wife,Samantha_Greene_Woodruff,4.16,"2,595",2022,"'An enthralling historical novel of a compassionate and relentless woman, a cutting-edge breakthrough in psychiatry, and a nightmare in the making.nnSince her brother took his life after WWI, Ruth Emeraldine has had one goal: to help those suffering from mental illness. Then she falls in love with charismatic Robert Apter—a brilliant doctor championing a radical new treatment, the lobotomy. Ruth believes in it as a miracle treatment and in Robert as its genius pioneer. But as her husband spirals into deluded megalomania, Ruth can’t ignore her growing suspicions. Robert is operating on patients recklessly, often with horrific results. And a vulnerable young mother, Margaret Baxter, is poised to be his next victim.nnMargaret can barely get out of bed, let alone care for her infant. When Dr. Apter diagnoses her with the baby blues and proposes a lobotomy, she believes the procedure is her only hope. Only Ruth can save her—and scores of others—from the harrowing consequences of Robert’s ambitions.nnInspired by a shocking chapter in medical history, The Lobotomist’s Wife is a galvanizing novel of a woman fighting against the most grievous odds, of ego, and of the best intentions gone horribly awry.'",Historical Fiction
/book/show/58456216-the-raven-spell,The Raven Spell (Conspiracy of Magic #1),Luanne_G_Smith,4.14,"2,160",2022,"'In Victorian England a witch and a detective are on the hunt for a serial killer in an enthralling novel of magic and murder.nnAfter a nearly fatal blow to the skull, traumatized private detective Ian Cameron is found dazed and confused on a muddy riverbank in Victorian London. Among his effects: a bloodstained business card bearing the name of a master wizard and a curious pocket watch that doesn’t seem to tell time. To retrieve his lost memories, Ian demands answers from Edwina and Mary Blackwood, sister witches with a murky past. But as their secret is slowly unveiled, a dangerous mystery emerges on the darkened streets of London.nnTo help piece together Ian’s lost time, he and Edwina embark on a journey that will take them from the river foreshore to an East End music hall, and on to a safe house for witches in need of sanctuary from angry mortals. The clues they find suggest a link between a series of gruesome murders, a missing person’s case, and a dreadful suspicion that threatens to tear apart the bonds of sisterhood. As the investigation deepens, could Ian and Edwina be the next to die?'",Historical Fiction
/book/show/57747930-never,Never,Ken_Follett,4.14,"12,848",2021,"""The new must-read epic from master storyteller Ken Follett: more than a thriller, it's an action-packed, globe-spanning drama set in the present day.nnIn the Sahara Desert, two elite intelligence agents are on the trail of a powerful group of drug-smuggling terrorists, risking their lives--and, when they fall desperately in love, their careers--at every turn. Nearby, a beautiful young widow fights against human traffickers while traveling illegally to Europe with the help of a mysterious man who may not be who he says he is.nnIn China, a senior government official with vast ambitions for himself and his country battles against the older Communist hawks in the government, who may be pushing China--and its close military ally, North Korea--to a place of no return.nnAnd in the United States, Pauline Green, the country's first woman president, navigates terrorist attacks, illegal arms trading, and the smear campaigns of her blustering political opponent with careful and deft diplomacy. She will do everything in her power to avoid starting an unnecessary war. But when one act of aggression leads to another, the most powerful countries in the world are caught in a complex web of alliances they can't escape. And once all the sinister pieces are in place, can anyone--even those with the best of intentions and most elite skills--stop the inevitable?nnNever is an extraordinary thriller, full of heroines and villains, false prophets and elite warriors, jaded politicians and opportunistic revolutionaries. It brims with cautionary wisdom for our times, and a delivers a visceral, heart-pounding read that transports readers to the brink of the unimaginable.""",Historical Fiction
/book/show/52772417-kingdom-of-the-cursed,"Kingdom of the Cursed (Kingdom of the Wicked, #2)",Kerri_Maniscalco,4.29,"39,938",2021,"'After selling her soul to become Queen of the Wicked, Emilia travels to the Seven Circles with the enigmatic Prince of Wrath, where she’s introduced to a seductive world of vice.nnShe vows to do whatever it takes to avenge her beloved sister, Vittoria... even if that means accepting the hand of the Prince of Pride, the king of demons.nnThe first rule in the court of the Wicked? Trust no one. With back-stabbing princes, luxurious palaces, mysterious party invitations, and conflicting clues about who really killed her twin, Emilia finds herself more alone than ever before. Can she even trust Wrath, her one-time ally in the mortal world... or is he keeping dangerous secrets about his true nature? nnEmilia will be tested in every way as she seeks a series of magical objects that will unlock the clues of her past and the answers she craves...nnOne sister. nTwo sinful princes.nInfinite deception with a side of revenge… Welcome to Hell.nnFrom #1 New York Times bestselling author of Stalking Jack the Ripper Kerri Maniscalco comes the sizzling, sweepingly romantic sequel to Kingdom of the Wicked!'",Historical Fiction
/book/show/52735921-kingdom-of-the-wicked,"Kingdom of the Wicked (Kingdom of the Wicked, #1)",Kerri_Maniscalco,4.00,"91,316",2020,"'Two sisters.nnOne brutal murder.nnA quest for vengeance that will unleash Hell itself…nnAnd an intoxicating romance.nnEmilia and her twin sister Vittoria are streghe – witches who live secretly among humans, avoiding notice and persecution. One night, Vittoria misses dinner service at the family’s renowned Sicilian restaurant. Emilia soon finds the body of her beloved twin…desecrated beyond belief. Devastated, Emilia sets out to find her sister’s killer and to seek vengeance at any cost-even if it means using dark magic that’s been long forbidden.nnThen Emilia meets Wrath, one of the Wicked-princes of Hell she has been warned against in tales since she was a child. Wrath claims to be on Emilia’s side, tasked by his master with solving the series of women’s murders on the island. But when it comes to the Wicked, nothing is as it seems…'",Historical Fiction
/book/show/53914938-the-rose-code,The Rose Code,Kate_Quinn,4.48,"92,283",2021,"'1940. As England prepares to fight the Nazis, three very different women answer the call to mysterious country estate Bletchley Park, where the best minds in Britain train to break German military codes. Vivacious debutante Osla is the girl who has everything—beauty, wealth, and the dashing Prince Philip of Greece sending her roses—but she burns to prove herself as more than a society girl, and puts her fluent German to use as a translator of decoded enemy secrets. Imperious self-made Mab, product of East-End London poverty, works the legendary code-breaking machines as she conceals old wounds and looks for a socially advantageous husband. Both Osla and Mab are quick to see the potential in local village spinster Beth, whose shyness conceals a brilliant facility with puzzles, and soon Beth spreads her wings as one of the Park’s few female cryptanalysts. But war, loss, and the impossible pressure of secrecy will tear the three apart. nn1947. As the royal wedding of Princess Elizabeth and Prince Philip whips post-war Britain into a fever, three friends-turned-enemies are reunited by a mysterious encrypted letter—the key to which lies buried in the long-ago betrayal that destroyed their friendship and left one of them confined to an asylum. A mysterious traitor has emerged from the shadows of their Bletchley Park past, and now Osla, Mab, and Beth must resurrect their old alliance and crack one last code together. But each petal they remove from the rose code brings danger—and their true enemy—closer...'",Historical Fiction
/book/show/43890641-hamnet,Hamnet,Maggie_O_Farrell,4.27,"127,253",2020,"""A New York Times Notable Book (2020)nBest Book of 2020: Guardian, Financial Times, Literary Hub, and NPRnnDrawing on Maggie O'Farrell's long-term fascination with the little-known story behind Shakespeare's most enigmatic play, HAMNET is a luminous portrait of a marriage, at its heart the loss of a beloved child. nnWarwickshire in the 1580s. Agnes is a woman as feared as she is sought after for her unusual gifts. She settles with her husband in Henley street, Stratford, and has three children: a daughter, Susanna, and then twins, Hamnet and Judith. The boy, Hamnet, dies in 1596, aged eleven. Four years or so later, the husband writes a play called Hamlet. nnAward-winning author Maggie O'Farrell's new novel breathes full-blooded life into the story of a loss usually consigned to literary footnotes, and provides an unforgettable vindication of Agnes, a woman intriguingly absent from history.""",Historical Fiction
/book/show/58262303-the-taste-of-ginger,The Taste of Ginger,Mansi_Shah,4.06,"4,503",2021,"'In Mansi Shah’s stunning debut novel, a family tragedy beckons a first-generation immigrant to the city of her birth, where she grapples with her family’s past in search of where she truly belongs.nnAfter her parents moved her and her brother to America, Preeti Desai never meant to tear her family apart. All she did was fall in love with a white Christian carnivore instead of a conventional Indian boy. Years later, with her parents not speaking to her and her controversial relationship in tatters, all Preeti has left is her career at a prestigious Los Angeles law firm.nnBut when Preeti receives word of a terrible accident in the city where she was born, she returns to India, where she’ll have to face her estranged parents…and the complicated past they left behind. Surrounded by the sights and sounds of her heritage, Preeti catches a startling glimpse of her family’s battles with class, tradition, and sacrifice. Torn between two beautifully flawed cultures, Preeti must now untangle what home truly means to her.'",Historical Fiction
/book/show/53152636-mexican-gothic,Mexican Gothic,Silvia_Moreno_Garcia,3.69,"208,195",2020,"'After receiving a frantic letter from her newly-wed cousin begging for someone to save her from a mysterious doom, Noemí Taboada heads to High Place, a distant house in the Mexican countryside. She’s not sure what she will find—her cousin’s husband, a handsome Englishman, is a stranger, and Noemí knows little about the region. n nNoemí is also an unlikely rescuer: She’s a glamorous debutante, and her chic gowns and perfect red lipstick are more suited for cocktail parties than amateur sleuthing. But she’s also tough and smart, with an indomitable will, and she is not afraid: Not of her cousin’s new husband, who is both menacing and alluring; not of his father, the ancient patriarch who seems to be fascinated by Noemí; and not even of the house itself, which begins to invade Noemí’s dreams with visions of blood and doom.n nHer only ally in this inhospitable abode is the family’s youngest son. Shy and gentle, he seems to want to help Noemí, but might also be hiding dark knowledge of his family’s past. For there are many secrets behind the walls of High Place. The family’s once colossal wealth and faded mining empire kept them from prying eyes, but as Noemí digs deeper she unearths stories of violence and madness. n nAnd Noemí, mesmerized by the terrifying yet seductive world of High Place, may soon find it impossible to ever leave this enigmatic house behind.'",Historical Fiction
/book/show/57185348-matrix,Matrix,Lauren_Groff,3.81,"18,898",2021,"""A Financial Times and NPR Best Book of 2021nA Virginia Living Favorite Book (2021)nnLauren Groff returns with her exhilarating first new novel since the groundbreaking Fates and Furies.nnCast out of the royal court by Eleanor of Aquitaine, deemed too coarse and rough-hewn for marriage or courtly life, 17-year-old Marie de France is sent to England to be the new prioress of an impoverished abbey, its nuns on the brink of starvation and beset by disease.nnAt first taken aback by the severity of her new life, Marie finds focus and love in collective life with her singular and mercurial sisters. In this crucible, Marie steadily supplants her desire for family, for her homeland, for the passions of her youth with something new to her: devotion to her sisters, and a conviction in her own divine visions. Marie, born the last in a long line of women warriors and crusaders, is determined to chart a bold new course for the women she now leads and protects. But in a world that is shifting and corroding in frightening ways, one that can never reconcile itself with her existence, will the sheer force of Marie's vision be bulwark enough?nnEqually alive to the sacred and the profane, Matrix gathers currents of violence, sensuality, and religious ecstasy in a mesmerizing portrait of consuming passion, aberrant faith, and a woman that history moves both through and around. Lauren Groff's new novel, her first since Fates and Furies, is a defiant and timely exploration of the raw power of female creativity in a corrupted world.""",Historical Fiction
/book/show/56271394-honor,Honor,Thrity_Umrigar,4.51,"2,477",2022,"""THE NEW REESE'S BOOK CLUB PICK FOR JANUARY!nnIn this riveting and immersive novel, bestselling author Thrity Umrigar tells the story of two couples and the sometimes dangerous and heartbreaking challenges of love across a cultural divide.nnIndian\xa0American journalist\xa0Smita has returned to India to cover a story, but reluctantly: long ago she and her family left the country with no intention of ever coming back. As she follows the case of Meena—a Hindu woman attacked by members of her own village and her own family for marrying a Muslim man—Smita comes face to face with a society where tradition carries more weight than one’s own heart, and a story that threatens to unearth the painful secrets of Smita’s own past. While Meena’s fate hangs in the balance, Smita tries in every way she can to right the scales. She also finds herself increasingly drawn to Mohan, an Indian man she meets while on assignment. But the dual love stories of Honor are as different as the cultures of Meena and Smita themselves: Smita realizes she has the freedom to enter into a casual affair, knowing she can decide later how much it means to her.nnIn this tender and evocative novel about love, hope, familial devotion, betrayal, and sacrifice, Thrity Umrigar shows us two courageous women trying to navigate how to be true to their homelands and themselves at the same time.""",Historical Fiction
