Url,Title,Author,Rate,Ratings,Year,Abstract,Genre
/book/show/56173022-murder-on-a-midnight-clear,"Murder on a Midnight Clear (High Society Lady Detective, #6)",Sara_Rosett,4.12,"1,534",2020,"' A snowbound country mansion, a missing butler, and a Christmas case . . .nnnOlive and Jasper have never been closer—except in one area. Jasper is still reticent about his frequent disappearances from polite society. With the holidays approaching and no paying client on the books, Olive decides to shadow Jasper when he’s unexpectedly called away. Her search brings her to Holly Hill Lodge where an eclectic group has gathered to celebrate an old-fashioned English Christmas.nnnThe guest list includes a celebrated lawn tennis champion, a fussy scientist studying snowflakes, a persuasive luggage salesman, a famous lady explorer, and the family’s eccentric aunt who has a fondness for the newfangled drinks called cocktails.nnnWhen the butler goes missing, Olive and Jasper must work together to solve the Christmas crime—as well as the secret Jasper hides. Murder on a Midnight Clear is the latest installment in USA Today bestselling author Sara Rosett’s popular High Society Lady Detective series.nnnUnwrap this 1920s Christmas mystery with all the trimmings—carols, a Yule log, plum pudding . . . and murder.'",Historical Fiction
/book/show/53514241-liar,Liar,Lesley_Pearse,3.93,"2,760",2020,"""Amelia White dreamed of being a reporter, but the closest she'd come was selling advertising in the local paper.nnUntil the fateful day she stumbles on a truly shocking scoop.nnA murder victim, round the corner from her home.nnWhen the police and reporters descend, Amelia is horrified at the assumptions made and lies soon to be spread about this poor young woman.nnConvincing her local paper to let her take up the story herself, Amelia is determined to protect the victim from these smears. But when another body is found, the police investigation stalls.nnNow, Amelia's own unfolding investigation may be the only chance of uncovering the truth, and stopping more killings.nnIf only she can work out who the liar is . . .nnPraise for Lesley Pearsenn'Storytelling at its very best' Daily Mailnn'Evocative, compelling, told from the heart' Sunday Expressnn'Glorious, heartwarming' Woman &amp; Homenn'Intriguing, heart-tugging, beautifully written' Closer""",Historical Fiction
/book/show/55959425-year-of-the-reaper,Year of the Reaper,Makiia_Lucier,4.16,"1,540",2021,"""The past never forgets...nnBefore an ambush by enemy soldiers, Lord Cassia was an engineer's apprentice on a mission entrusted by the king. But when plague sweeps over the land, leaving countless dead and devastating the kingdom, even Cas’ title cannot save him from a rotting prison cell and a merciless sickness.nnThree years later, Cas wants only to return to his home in the mountains and forget past horrors. But home is not what he remembers. His castle has become a refuge for the royal court. And they have brought their enemies with them.nnWhen an assassin targets those closest to the queen, Cas is drawn into a search for a killer… one that leads him to form an unexpected bond with a brilliant young historian named Lena. Cas and Lena soon realize that who is behind the attacks is far less important than why. They must look to the past, following the trail of a terrible secret—one that could threaten the kingdom’s newfound peace and plunge it back into war.""",Historical Fiction
/book/show/44323551-unspeakable-things,Unspeakable Things,Jess_Lourey,3.84,"56,822",2020,"'Inspired by a terrifying true story from the author’s hometown in Minnesota -a community where nothing is as quiet—or as safe—as it seems.nnCassie McDowell’s life in 1980s Minnesota seems perfectly wholesome. She lives on a farm, loves school, and has a crush on the nicest boy in class. Yes, there are her parents’ strange parties and their parade of deviant guests, but she’s grown accustomed to them.nnAll that changes when someone comes hunting in Lilydale.nnOne by one, local boys go missing. One by one, they return changed—violent, moody, and withdrawn. What happened to them becomes the stuff of shocking rumors. The accusations of who’s responsible grow just as wild, and dangerous town secrets start to surface. Then Cassie’s own sister undergoes the dark change. If she is to survive, Cassie must find her way in an adult world where every sin is justified, and only the truth is unforgivable.'",Historical Fiction
/book/show/38097931-the-art-of-inheriting-secrets,The Art of Inheriting Secrets,Barbara_O_Neal,4.25,"49,947",2018,"'When Olivia Shaw’s mother dies, the sophisticated food editor is astonished to learn she’s inherited a centuries-old English estate—and a title to go with it. Raw with grief and reeling from the knowledge that her reserved mother hid something so momentous, Olivia leaves San Francisco and crosses the pond to unravel the mystery of a lifetime.nnOne glance at the breathtaking Rosemere Priory and Olivia understands why the manor, magnificent even in disrepair, was the subject of her mother’s exquisite paintings. What she doesn’t understand is why her mother never mentioned it to her. As Olivia begins digging into her mother’s past, she discovers that the peeling wallpaper, debris-laden halls, and ceiling-high Elizabethan windows covered in lush green vines hide unimaginable secrets.nnAlthough personal problems and her life back home beckon, Olivia finds herself falling for the charming English village and its residents. But before she can decide what Rosemere’s and her own future hold, Olivia must first untangle the secrets of her past.'",Historical Fiction
/book/show/58701949-heaven-official-s-blessing,Heaven Official's Blessing: Tian Guan Ci Fu (Novel) Vol. 1,M_Xi_ng_T_ng_Xi_,4.74,"2,125",2021,"'Born the crown prince of a prosperous kingdom, Xie Lian was renowned for his beauty, strength, and purity. His years of dedication and noble deeds allowed him to ascend to godhood. But those who rise, can also fall...and fall he does, cast from the Heavens again and again and banished to the mortal realm.nnEight hundred years after his mortal life, Xie Lian has ascended to godhood for the third time. Now only a lowly scrap collector, he is dispatched to wander the earthly realm to take on tasks appointed by the heavens to pay back debts and maintain his divinity. Aided by old friends and foes alike, and graced with the company of a mysterious young man with whom he feels an instant connection, Xie Lian must confront the horrors of his past in order to dispel the curse of his present.'",Historical Fiction
/book/show/58821991-miss-dignified,"Miss Dignified (Mischief in Mayfair, #3)",Grace_Burrowes,4.43,469,2022,"'Lydia Lovelace has taken the housekeeper’s post in the London home of Captain Dylan Powell. The captain is short on charm, but he’s known for his rapport with, and support of, former soldiers trying to make a peacetime life in London. Unbeknownst to the captain, Lydia is searching for a brother who never came home after Waterloo, a brother whose birthright, along with Lydia’s settlements, is being frittered away by scheming family members.nnDylan has never viewed his home as much more than a place to take meals and sleep out of the wet while he finds paying work and good positions for his former subordinates. The new housekeeper is changing all of that, bringing comfort and tranquility to Dylan’s domicile and to his days. When Dylan and Lydia begin to explore pleasures shared in the night, Lydia realizes she will have to choose between loyalty to her long-lost brother and a future with the captain who has stolen her heart.'",Historical Fiction
/book/show/53240276-the-betrayed,"The Betrayed (The Betrothed, #2)",Kiera_Cass,3.74,"6,511",2021,"'Kiera Cass brings another sparkling romance to a stunning conclusion in this sequel to the instant #1 New York Times bestseller The Betrothed.nnCan you follow your heart when it’s already broken?nnAfter fleeing Coroa and leaving the memory of her beloved Silas behind, Hollis is unsteadily adjusting to life in Isolte. The Eastoffe family’s affection is a balm on her weary spirit, though Etan, a surly cousin with a deep distaste for Coroans, threatens to upset the uneasy peace she’s found.nnWhile tensions at home ratchet up, disquiet in the kingdom of Isolte is reaching a fever pitch. The Eastoffes may have the power to unseat a tyrannical king—but only with Hollis’s help.nnCan a girl who’s lost it all put the fate of her adopted homeland over the secret longings of her heart?'",Historical Fiction
/book/show/56898079-forgiving-paris,Forgiving Paris,Karen_Kingsbury,4.16,"4,796",2021,"""Could Ashley Baxter Blake's journey to forgiveness lead her back to the City of Light?nnIn Indiana, Ashley Baxter Blake and her husband are about to take an anniversary trip to Paris, where a French gallery will show her paintings. But Ashley is hesitant. More than two decades ago, she made her most grievous mistake in Paris. She has never forgiven herself for what happened there, and she still harbors secrets that she’s afraid will come to light. Just before the trip, Ashley gets a call from her niece. Jessie explains that her boyfriend’s mother, Alice, remembers working at a bakery with an American named Ashley. “Could that be you?” nnWhen Alice and Ashley meet, a flood of memories comes for both women, taking Ashley back to a reckless affair and an unexpected pregnancy and Alice to the night she nearly ended it all. Can this reunion bring healing and closure? Maybe it is finally time for Ashley to forgive herself...and Paris.nnSometimes forgiveness can be found only by going back to where the unthinkable happened...and putting it to rest. Once and for all.""",Historical Fiction
/book/show/43263542-nothing-ventured,"Nothing Ventured (Detective William Warwick, #1)",Jeffrey_Archer,3.91,"29,669",2019,"'Nothing Ventured heralds the start of a brand-new series in the style of Jeffrey Archer’s #1 New York Times bestselling Clifton Chronicles: introducing Detective William Warwick. But this is not a detective story, this is a story about the making of a detective . . .nnWilliam Warwick has always wanted to be a detective, and decides, much to his father’s dismay, that rather than become a lawyer like his father, Sir Julian Warwick QC, and his sister Grace, he will join London’s Metropolitan Police Force.nnAfter graduating from university, William begins a career that will define his life: from his early months on the beat under the watchful eye of his first mentor, Constable Fred Yates, to his first high-stakes case as a fledgling detective in Scotland Yard’s arts and antiquities squad. Investigating the theft of a priceless Rembrandt painting from the Fitzmolean Museum, he meets Beth Rainsford, a research assistant at the gallery who he falls hopelessly in love with, even as Beth guards a secret of her own that she’s terrified will come to light.nnWhile William follows the trail of the missing masterpiece, he comes up against suave art collector Miles Faulkner and his brilliant lawyer, Booth Watson QC, who are willing to bend the law to breaking point to stay one step ahead of William. Meanwhile, Miles Faulkner’s wife, Christina, befriends William, but whose side is she really on?nnThis new series introduces William Warwick, a family man and a detective who will battle throughout his career against a powerful criminal nemesis. Through twists, triumph and tragedy, this series will show that William Warwick is destined to become one of Jeffrey Archer’s most enduring legacies.'",Historical Fiction
/book/show/54589749-turn-a-blind-eye,"Turn a Blind Eye (Detective William Warwick, #3)",Jeffrey_Archer,4.16,"8,103",2021,"""Turn a Blind Eye is the third installment in the gripping story of Detective Inspector William Warwick, by the master storyteller and #1 New York Times bestselling author of the Clifton Chronicles.nnnnNewly promoted to Detective Inspector, William Warwick is tasked with a dangerous new line of work, to go undercover and expose crime of another kind: corruption at the heart of the Metropolitan Police Force. Along with detectives Rebecca Pankhurst and Nicky Bailey, his team is focused on following Detective Jerry Summers, a young officer whose lifestyle exceeds his income. But the investigation risks being compromised when Nicky falls for Summers.Meanwhile, notorious drug baron Ahmed Rashidi goes on trial, defended by Booth Watson QC, while William's father Sir Julian and sister Grace lead the prosecution case. And William's wife Beth, now a new mother to twins, makes a surprising new friend in Christina Faulkner--the ex-wife of William's former rival, criminal financier Miles - who has not only turned over a new leaf, but also has a new-found source of income when Faulkner dies suddenly of a heart attack and she stands to be sole inheritor of his estate.As the undercover officers start to draw the threads together, William realizes that the corruption may go deeper still, and more of his colleagues than he first thought might be willing to turn a blind eye.""",Historical Fiction
/book/show/35148164-the-moon-sister,"The Moon Sister (The Seven Sisters, #5)",Lucinda_Riley,4.23,"32,085",2018,"'From New York Times bestselling author Lucinda Riley, n  The Moon Sistern transports you to the grandeur of the remote Scottish Highlands and the gypsy caves of Granada, just as Spain descends into civil war, interweaving the stories of two women searching for their destinies, at the risk of potentially losing their chance at love.Tiggy D’Aplièse spends her days experiencing the raw beauty of the Scottish Highlands doing a job she loves at a deer sanctuary. But when the sanctuary is forced to close, she is offered a job as a wildlife consultant on the vast and isolated estate of the elusive and troubled laird, Charlie Kinnaird. She has no idea that the move will not only irrevocably alter her future, but also bring her face-to-face with her past.At the estate, she meets Chilly, a gypsy who fled from Spain seventy years before. He tells her that not only does she possess a sixth sense passed down from her ancestors, but it was foretold long ago that he would be the one to send her back home…In 1912, in the poor gypsy community outside the city walls of Granada, Lucía Amaya-Albaycin is born. Destined to be the greatest flamenco dancer of her generation—and named La Candela, due to the inner flame that burns through her when she dances— Lucía is whisked away by her ambitious and talented guitarist father at the tender age of ten to dance in the flamenco bars of Barcelona. Her mother is devastated by the loss of her daughter and as civil war threatens in Spain, tragedy strikes the rest of her family. Now in Madrid, Lucía and her troupe of dancers are forced to flee for their lives, their journey taking them far across the water to South America and eventually, to North America and New York—Lucía’s long-held dream. But to pursue it, she must choose between her passion for her career and the man she adores. The Moon Sister follows these two women on their journey to discover their true futures—but at the risk of potentially losing the men they had hoped to build futures with.'",Historical Fiction
/book/show/54883185-churchill-s-secret-messenger,Churchill's Secret Messenger,Alan_Hlad,4.45,"1,776",2021,"'A riveting story of World War II and the courage of one young woman as she is drafted into Churchill’s overseas spy network, aiding the French Resistance behind enemy lines and working to liberate Nazi-occupied Paris…n nLondon, 1941: In a cramped bunker in Winston Churchill’s Cabinet War Rooms, underneath Westminster’s Treasury building, civilian women huddle at desks, typing up confidential documents and reports. Since her parents were killed in a bombing raid, Rose Teasdale has spent more hours than usual in Room 60, working double shifts, growing accustomed to the burnt scent of the Prime Minister’s cigars permeating the stale air. Winning the war is the only thing that matters, and she will gladly do her part. And when Rose’s fluency in French comes to the attention of Churchill himself, it brings a rare yet dangerous opportunity.nnRose is recruited for the Special Operations Executive, a secret British organization that conducts espionage in Nazi-occupied Europe. After weeks of grueling training, Rose parachutes into France with a new codename: Dragonfly. Posing as a cosmetics saleswoman in Paris, she ferries messages to and from the Resistance, knowing that the slightest misstep means capture or death.nnSoon Rose is assigned to a new mission with Lazare Aron, a French Resistance fighter who has watched his beloved Paris become a shell of itself, with desolate streets and buildings draped in Swastikas. Since his parents were sent to a German work camp, Lazare has dedicated himself to the cause with the same fervor as Rose. Yet Rose’s very loyalty brings risks as she undertakes a high-stakes prison raid, and discovers how much she may have to sacrifice to justify Churchill’s faith in her . . .'",Historical Fiction
/book/show/56637379-god-rest-ye-royal-gentlemen,"God Rest Ye, Royal Gentlemen (Her Royal Spyness, #15)",Rhys_Bowen,4.22,"3,779",2021,"'Georgie is back and hanging the stockings with care when a murder interrupts her Christmas cheer in this all-new installment in the New York Times bestselling Royal Spyness series from Rhys Bowen.nnGeorgie is excited for her first Christmas as a married woman in her lovely new home. She suggests to her dashing husband, Darcy, that they have a little house party, but when Darcy receives a letter from his aunt Ermintrude, there is an abrupt change in plans. She has moved to a house on the edge of the Sandringham estate, near the royal family, and wants to invite Darcy and his new bride for Christmas. Aunt Ermintrude hints that the queen would like Georgie nearby. Georgie had not known that Aunt Ermintrude was a former lady-in-waiting and close confidante of her royal highness. The letter is therefore almost a royal request, so Georgie, Darcy, and their Christmas guests: Mummy, Grandad, Fig, and Binky all head to Sandringham.nnGeorgie soon learns that the notorious Mrs. Simpson, mistress to the Prince of Wales, will also be in attendance. It is now crystal clear to Georgie that the Queen expects her to do a bit of spying. There is tension in the air from the get-go, and when Georgie pays a visit to the queen, she learns that there is more to her request than just some simple eavesdropping. There have been a couple of strange accidents at the estate recently. Two gentlemen of the royal household have died in mysterious circumstances and another has been shot by mistake during a hunt. Georgie begins to suspect that a member of the royal family is the real target but her investigation will put her new husband and love of her life, Darcy, in the crosshairs of a killer.'",Historical Fiction
/book/show/34384037-the-hideaway,The Hideaway,Lauren_K_Denton,3.95,"42,215",2017,"'When her grandmother’s will wrenches Sara back home, she learns more about Margaret Van Buren in the wake of her death than she ever knew in life.nnAfter her last remaining family member dies, Sara Jenkins goes home to The Hideaway, her grandmother Mags’s ramshackle B&amp;B in Sweet Bay, Alabama. She intends to quickly tie up loose ends then return to her busy life and thriving antique shop in New Orleans. Instead, she learns Mags has willed The Hideaway to her and charged her with renovating it—no small task considering her grandmother’s best friends, a motley crew of senior citizens, still live there.nnRather than hurrying back to New Orleans, Sara stays in Sweet Bay and begins the biggest house-rehabbing project of her career. Amid drywall dust, old memories, and a charming contractor, she discovers that slipping back into life at The Hideaway is easier than she expected.nnThen she discovers a box Mags left in the attic with clues to a life Sara never imagined for her grandmother. With help from Mags’s friends, Sara begins to piece together the mysterious life of bravery, passion, and choices that changed her grandmother’s destiny in both marvelous and devastating ways.nnWhen an opportunistic land developer threatens to seize The Hideaway, Sara is forced to make a choice—stay in Sweet Bay and fight for the house and the people she’s grown to love or leave again and return to her successful but solitary life in New Orleans.'",Historical Fiction
/book/show/54837684-the-longest-echo,The Longest Echo,Eoin_Dempsey,4.37,"4,529",2021,"'Against the backdrop of WWII-ravaged Italy comes a powerful and emotional novel of love, survival, justice, and second chances by the bestselling author of White Rose, Black Forest.nnOccupied Italy, 1944. In the mountain regions south of Bologna, Liliana Nicoletti’s family finds escaped POW James Foley behind German lines. Committed to the anti-Fascist cause, they deliver him to a powerful band of local partisans. But when the SS launches a brutal attack against the Resistance, Liliana’s peaceful community is destroyed. Alone and thrown together by tragedy, James and Liliana fight together as Monte Sole burns. Forging an unbreakable bond, their only hope of survival is to make it to the Allied lines.nnTwelve years later, fate reunites Liliana, newly widowed, and James, now a journalist for a New York magazine. Liliana reveals to him the obsession that has haunted her since the massacre at Monte Sole: finding and bringing to justice the SS officer who ordered her family killed. James has a revelation too. He might know how to hunt the man down. Joining forces once more, and increasingly drawn to each other, Liliana and James discover new levels of conspiracy on a journey that leads them to Argentina—and to a choice that will change their lives forever.'",Historical Fiction
/book/show/56898260-the-last-dance-of-the-debutante,The Last Dance of the Debutante,Julia_Kelly,4.09,750,2022,"'The author of the “sweeping, stirring, and heartrending” (Kristin Harmel, author of The Room on Rue Amélie) The Light Over London returns with a masterful, glittering novel that whisks you to midcentury Britain as it follows three of the last debutantes to be presented to Queen Elizabeth II.When it’s announced that 1958 will be the last year debutantes are to be presented at court, thousands of eager mothers and hopeful daughters flood the palace with letters seeking the year’s most coveted invitation: a chance for their daughters to curtsey to the young Queen Elizabeth and officially come out into society. In an effort to appease her traditional mother, aspiring university student Lily Nichols agrees to become a debutante and do the Season, a glittering and grueling string of countless balls and cocktail parties. In doing so, she befriends two very different women: the cool and aloof Leana Hartford whose apparent perfection hides a darker side and the ambitious Katherine Norman who dreams of a career once she helps her parents find their place among the elite. But the glorious effervescence of the Season evaporates once Lily learns a devastating secret that threatens to destroy her entire family. Faced with a dark past, she’s forced to ask herself what really matters: her family legacy or her own happiness. With her signature “intricate, tender, and convincing” (Publishers Weekly) storytelling, Julia Kelly weaves an unforgettable tale of female friendship amid the twilight days of Britain’s grand coming out balls.'",Historical Fiction
/book/show/30288282-the-immortalists,The Immortalists,Chloe_Benjamin,3.71,"177,421",2018,"""If you knew the date of your death, how would you live your life?nnIt's 1969 in New York City's Lower East Side, and word has spread of the arrival of a mystical woman, a traveling psychic who claims to be able to tell anyone the day they will die. The Gold children—four adolescents on the cusp of self-awareness—sneak out to hear their fortunes.nnThe prophecies inform their next five decades. Golden-boy Simon escapes to the West Coast, searching for love in '80s San Francisco; dreamy Klara becomes a Las Vegas magician, obsessed with blurring reality and fantasy; eldest son Daniel seeks security as an army doctor post-9/11; and bookish Varya throws herself into longevity research, where she tests the boundary between science and immortality.nnA sweeping novel of remarkable ambition and depth, The Immortalists probes the line between destiny and choice, reality and illusion, this world and the next. It is a deeply moving testament to the power of story, the nature of belief, and the unrelenting pull of familial bonds.""",Historical Fiction
