Url,Title,Author,Rate,Ratings,Year,Abstract,Genre
/book/show/58662236-small-things-like-these,Small Things Like These,Claire_Keegan,4.28,"7,431",2020,"'It is 1985 in a small Irish town. During the weeks leading up to Christmas, Bill Furlong, a coal merchant and family man faces into his busiest season. Early one morning, while delivering an order to the local convent, Bill makes a discovery which forces him to confront both his past and the complicit silences of a town controlled by the church. nnAlready an international bestseller, Small Things Like These is a deeply affecting story of hope, quiet heroism, and empathy from one of our most critically lauded and iconic writers.'",Historical Fiction
/book/show/44318414-the-dutch-house,The Dutch House,Ann_Patchett,4.11,"326,205",2019,"'At the end of the Second World War, Cyril Conroy combines luck and a single canny investment to begin an enormous real estate empire, propelling his family from poverty to enormous wealth. His first order of business is to buy the Dutch House, a lavish estate in the suburbs outside of Philadelphia. Meant as a surprise for his wife, the house sets in motion the undoing of everyone he loves.nnThe story is told by Cyril’s son Danny, as he and his older sister, the brilliantly acerbic and self-assured Maeve, are exiled from the house where they grew up by their stepmother. The two wealthy siblings are thrown back into the poverty their parents had escaped from and find that all they have to count on is one another. It is this unshakable bond between them that both saves their lives and thwarts their futures.nnSet over the course of five decades, The Dutch House is a dark fairy tale about two smart people who cannot overcome their past. Despite every outward sign of success, Danny and Maeve are only truly comfortable when they’re together. Throughout their lives, they return to the well-worn story of what they’ve lost with humor and rage. But when at last they’re forced to confront the people who left them behind, the relationship between an indulged brother and his ever-protective sister is finally tested.'",Historical Fiction
/book/show/40914165-the-book-woman-of-troublesome-creek,The Book Woman of Troublesome Creek,Kim_Michele_Richardson,4.23,"130,526",2019,"""An alternate cover edition for ISBN 978-1492671527 can be found here.nnIn 1936, tucked deep into the woods of Troublesome Creek, KY, lives blue-skinned 19-year-old Cussy Carter, the last living female of the rare Blue People ancestry. nnThe lonely young Appalachian woman joins the historical Pack Horse Library Project of Kentucky and becomes a librarian, riding across slippery creek beds and up treacherous mountains on her faithful mule to deliver books and other reading material to the impoverished hill people of Eastern Kentucky.nnAlong her dangerous route, Cussy, known to the mountain folk as Bluet, confronts those suspicious of her damselfly-blue skin and the government's new book program. She befriends hardscrabble and complex fellow Kentuckians, and is fiercely determined to bring comfort and joy, instill literacy, and give to those who have nothing, a bookly respite, a fleeting retreat to faraway lands.""",Historical Fiction
/book/show/53331577-the-last-bookshop-in-london,The Last Bookshop in London: A Novel of World War II,Madeline_Martin,4.17,"24,073",2021,"'Inspired by the true World War II history of the few bookshops to survive the Blitz, The Last Bookshop in London is a timeless story of wartime loss, love and the enduring power of literature.nnAugust 1939: London prepares for war as Hitler’s forces sweep across Europe. Grace Bennett has always dreamed of moving to the city, but the bunkers and blackout curtains that she finds on her arrival were not what she expected. And she certainly never imagined she’d wind up working at Primrose Hill, a dusty old bookshop nestled in the heart of London.nnThrough blackouts and air raids as the Blitz intensifies, Grace discovers the power of storytelling to unite her community in ways she never dreamed—a force that triumphs over even the darkest nights of the war.'",Historical Fiction
/book/show/57378152-flying-angels,Flying Angels,Danielle_Steel,4.32,"4,349",2021,"""n  World War II brings together six remarkable young flight nurses, who face the challenges of war and its many heartbreaks and victories as unsung heroes, in this inspiring novel from #1 New York Times bestselling author Danielle Steel.nnnAudrey Parker's life changes forever when Pearl Harbor is attacked on December 7, 1941. Her brother, a talented young Navy pilot, had been stationed there, poised to fulfill their late father's distinguished legacy. Fresh out of nursing school with a passion and a born gift for helping others, both Audrey and her friend Lizzie suddenly find their nation on the brink of war. Driven to do whatever they can to serve, they enlist in the Army and embark on a new adventure as flight nurses.nnRisking their lives on perilous missions, they join the elite Medical Air Evacuation Transport Squadron and fly into enemy territory almost daily to rescue wounded soldiers from the battlefield. Audrey and Lizzie make enormous sacrifices to save lives alongside an extraordinary group of nurses: Alex, who longs to make a difference in the world; Louise, a bright mind who faced racial prejudice growing up inthe South; Pru, a selfless leader with a heart of gold; and Emma, whose confidence and grit push her to put everything on the line for her patients.nnEven knowing they will not achieve any rank and will receive little pay for their efforts, the &quot;Flying Angels&quot; will give their all in the fight for freedom. They serve as bravely and tirelessly as the men they rescue on the front lines, in daring airlifts, and are eternally bound by their loyalty to one another. Danielle Steel presents a sweeping, stunning tribute to these incredibly courageous women, inspiring symbols of bravery and valor.""",Historical Fiction
/book/show/52761909-the-paris-library,The Paris Library,Janet_Skeslien_Charles,4.08,"57,171",2021,"'Based on the true World War II story of the heroic librarians at the American Library in Paris, this is an unforgettable story of romance, friendship, family, and the power of literature to bring us together, perfect for fans of The Lilac Girls and The Paris Wife. Paris, 1939: Young and ambitious Odile Souchet has it all: her handsome police officer beau and a dream job at the American Library in Paris. When the Nazis march into Paris, Odile stands to lose everything she holds dear, including her beloved library. Together with her fellow librarians, Odile joins the Resistance with the best weapons she has: books. But when the war finally ends, instead of freedom, Odile tastes the bitter sting of unspeakable betrayal. Montana, 1983: Lily is a lonely teenager looking for adventure in small-town Montana. Her interest is piqued by her solitary, elderly neighbor. As Lily uncovers more about her neighbor’s mysterious past, she finds that they share a love of language, the same longings, and the same intense jealousy, never suspecting that a dark secret from the past connects them. A powerful novel that explores the consequences of our choices and the relationships that make us who we are—family, friends, and favorite authors—The Paris Library shows that extraordinary heroism can sometimes be found in the quietest of places.'",Historical Fiction
/book/show/34051011-pachinko,Pachinko,Min_Jin_Lee,4.30,"293,550",2017,"""In the early 1900s, teenaged Sunja, the adored daughter of a crippled fisherman, falls for a wealthy stranger at the seashore near her home in Korea. He promises her the world, but when she discovers she is pregnant — and that her lover is married — she refuses to be bought. Instead, she accepts an offer of marriage from a gentle, sickly minister passing through on his way to Japan. But her decision to abandon her home, and to reject her son's powerful father, sets off a dramatic saga that will echo down through the generations.nnRichly told and profoundly moving, Pachinko is a story of love, sacrifice, ambition, and loyalty. From bustling street markets to the halls of Japan's finest universities to the pachinko parlors of the criminal underworld, Lee's complex and passionate characters — strong, stubborn women, devoted sisters and sons, fathers shaken by moral crisis — survive and thrive against the indifferent arc of history.""",Historical Fiction
/book/show/56806042-the-singing-trees,The Singing Trees,Boo_Walker,4.40,"7,487",2021,"'A young artist forges a path of self-discovery in an enriching novel about forgiving the past and embracing second chances, from the bestselling author of An Unfinished Story.nnMaine, 1969. After losing her parents in a car accident, aspiring artist Annalisa Mancuso lives with her grandmother and their large Italian family in the stifling factory town of Payton Mills. Inspired by her mother, whose own artistic dreams disappeared in a damaged marriage, Annalisa is dedicated only to painting. Closed off to love, and driven as much by her innate talent as she is the disillusionment of her past, Annalisa just wants to come into her own.nnThe first step is leaving Payton Mills and everything it represents. The next, the inspiring opportunities in the city of Portland and a thriving New England art scene where Annalisa hopes to find her voice. But she meets Thomas, an Ivy League student whose attentions—and troubled family—upend her pursuits in ways she never imagined possible. As their relationship deepens, Annalisa must balance her dreams against an unexpected love. Until the unraveling of an unforgivable lie.nnFor Annalisa, opening herself up to life and to love is a risk. It might also be the chance she needs to finally become the person and the artist she’s meant to be.'",Historical Fiction
/book/show/56281452-the-passing-storm,The Passing Storm,Christine_Nolfi,4.11,"6,471",2021,"'A gripping, openhearted novel about family, reconciliation, and bringing closure to the secrets of the past.nnEarly into the tempestuous decade of her thirties, Rae Langdon struggles to work through a grief she never anticipated. With her father, Connor, she tends to their Ohio farm, a forty-acre spread that itself has enjoyed better days. As memories sweep through her, some too precious to bear, Rae gives shelter from a brutal winter to a teenager named Quinn Galecki.nnQuinn has been thrown out by his parents, a couple too troubled to help steer the misunderstood boy through his own losses. Now Quinn has found a temporary home with the Langdons—and an unexpected kinship, because Rae, Quinn, and Connor share a past and understand one another’s pain. But its depths—and all its revelations and secrets—have yet to come to light. To finally move forward, Rae must confront them and also fight for Quinn, whose parents have other plans in mind for their son.nnWith forgiveness, love, and the spring thaw, there might be hope for a new season—a second chance Rae believed in her heart was gone forever.'",Historical Fiction
/book/show/55380172-reluctantly-home,Reluctantly Home,Imogen_Clark,4.25,"9,253",2021,"'From the bestselling author of Where the Story Starts comes a tale about dealing with the past—and finally facing the future.nnPip Appleby seems to have it all, with her prestigious job as a human rights lawyer and her enviable London home. But then a tragic accident stops her life in its tracks, and in an instant everything changes. Retreating to her family’s rural farm and the humble origins she has been trying to hide, Pip is haunted by what she has done.nnWhen she discovers the diary of actress Evelyn Mountcastle in a box of old books, Pip revels in the opportunity to lose herself in someone else’s life rather than focus on the disaster that is her own. But soon she sees parallels—Evelyn’s life was also beset by tragedy, and, like Pip, she returned to Southwold under a dark cloud.nnWhen Pip and Evelyn’s paths cross in real life they slowly begin to reveal the hidden stories that are holding them back. Can they help each other forgive what happened in the past and, perhaps, find happiness in the future?'",Historical Fiction
/book/show/52741293-shuggie-bain,Shuggie Bain,Douglas_Stuart,4.34,"83,232",2020,"""Shuggie Bain is the unforgettable story of young Hugh &quot;Shuggie&quot; Bain, a sweet and lonely boy who spends his 1980s childhood in run-down public housing in Glasgow, Scotland. Thatcher's policies have put husbands and sons out of work, and the city's notorious drugs epidemic is waiting in the wings. Shuggie's mother Agnes walks a wayward path: she is Shuggie's guiding light but a burden for him and his siblings. She dreams of a house with its own front door while she flicks through the pages of the Freemans catalogue, ordering a little happiness on credit, anything to brighten up her grey life. Married to a philandering taxi-driver husband, Agnes keeps her pride by looking good--her beehive, make-up, and pearly-white false teeth offer a glamourous image of a Glaswegian Elizabeth Taylor. But under the surface, Agnes finds increasing solace in drink, and she drains away the lion's share of each week's benefits--all the family has to live on--on cans of extra-strong lager hidden in handbags and poured into tea mugs. Agnes's older children find their own ways to get a safe distance from their mother, abandoning Shuggie to care for her as she swings between alcoholic binges and sobriety. Shuggie is meanwhile struggling to somehow become the normal boy he desperately longs to be, but everyone has realized that he is &quot;no right,&quot; a boy with a secret that all but him can see. Agnes is supportive of her son, but her addiction has the power to eclipse everyone close to her--even her beloved Shuggie.nnA heartbreaking story of addiction, sexuality, and love, Shuggie Bain is an epic portrayal of a working-class family that is rarely seen in fiction. Recalling the work of Edouard Louis, Alan Hollinghurst, Frank McCourt, and Hanya Yanagihara, it is a blistering debut by a brilliant novelist who has a powerful and important story to tell.""",Historical Fiction
/book/show/45033931-cilka-s-journey,"Cilka's Journey (The Tattooist of Auschwitz, #2)",Heather_Morris,4.39,"112,491",2019,"'In this follow-up to The Tattooist of Auschwitz, the author tells the story, based on a true one, of a woman who survives Auschwitz, only to find herself locked away again. nnCilka Klein is 18 years old when Auschwitz-Birkenau is liberated by Soviet soldiers. But Cilka is one of the many women who is sentenced to a labor camp on charges of having helped the Nazis--with no consideration of the circumstances Cilka and women like her found themselves in as they struggled to survive. Once at the Vorkuta gulag in Sibera, where she is to serve her 15-year sentence, Cilka uses her wits, charm, and beauty to survive.'",Historical Fiction
/book/show/58704871-half-in-shadow,Half in Shadow,Gemma_Liviero,4.37,"2,139",2022,"'From the bestselling author of In a Field of Blue comes an unforgettable novel about courage, love, and consequences at the dawn of World War I.nn1915. In German-occupied Belgium, a tragic loss forces Josephine Descharmes to navigate dangerous new territory. By day it’s compliance, serving German officers at the Hotel Métropole. By night it’s resistance, working with her brothers underground to help Allied soldiers and civilians cross the border into Holland. Both paths put her and her family at great risk.nnAs Josephine struggles to keep her family safe, Arthur, a grief-stricken English soldier trapped behind enemy lines, finds purpose and hope with Josephine and her work. Meanwhile, Franz, a German officer remorseful for the casualties of war, offers her protection and opportunity. These two men from opposing sides will open her heart and test her loyalties.nnAmid the sorrows of war and threats of mortal danger and betrayal, Josephine must steer her own fate. In a country deprived of freedom, she will make an impossible choice—one that will forever impact the family she cherishes and the man she loves.'",Historical Fiction
/book/show/25813942-this-tender-land,This Tender Land,William_Kent_Krueger,4.38,"109,761",2019,"""In the summer of 1932, on the banks of Minnesota's Gilead River, the Lincoln Indian Training School is a pitiless place where Native American children, forcibly separated from their parents, are sent to be educated. It is also home to Odie O’Banion, a lively orphan boy whose exploits constantly earn him the superintendent’s wrath. Odie and his brother, Albert, are the only white faces among the hundreds of Native American children at the school.nnAfter committing a terrible crime, Odie and Albert are forced to flee for their lives along with their best friend, Mose, a mute young man of Sioux heritage. Out of pity, they also take with them a brokenhearted little girl named Emmy. Together, they steal away in a canoe, heading for the mighty Mississippi in search for a place to call home.nnOver the course of one unforgettable summer, these four orphan vagabonds journey into the unknown, crossing paths with others who are adrift, from struggling farmers and traveling faith healers to displaced families and lost souls of all kinds. With the feel of a modern classic, This Tender Land is an en\xadthralling, bighearted epic that shows how the magnificent American landscape connects us all, haunts our dreams, and makes us whole.""",Historical Fiction
/book/show/54443692-an-ordinary-life,An Ordinary Life,Amanda_Prowse,4.47,"7,121",2021,"'From the bestselling author of The Girl in the Corner comes a tale of love, loss—and one last extraordinary dance.nnChristmas Eve, 2019. Ninety-four-year-old Molly lies in her hospital bed. A stroke and a fall may have broken her body—but her mind is alive with memories.nnLondon, 1940s. Molly is a bright young woman, determined to help the war effort and keep her head up despite it all. Life becomes brighter when she meets and falls in love with a man who makes her forget everything with one dance. But then war forces her to make an unforgettable sacrifice, and when she’s brought to her knees by a daring undercover mission with the French Resistance, only her sister knows the secret weighing heavily on Molly’s heart.nnNow, lying in her hospital bed, Molly can’t escape the memories of what she lost all those years ago. But she is not as alone as she thinks.nnWill she be able to find peace—and finally understand that what seemed to be an ordinary life was anything but?'",Historical Fiction
/book/show/55004546-the-secret-keeper-of-jaipur,"The Secret Keeper of Jaipur (The Henna Artist, #2)",Alka_Joshi,4.12,"20,383",2021,"'It’s the spring of 1969, and Lakshmi, now married to Dr. Jay Kumar, directs the Healing Garden in Shimla. Malik has finished his private school education. At twenty, he has just met a young woman named Nimmi when he leaves to apprentice at the Facilities Office of the Jaipur Royal Palace. Their latest project: a state-of-the-art cinema.nnMalik soon finds that not much has changed as he navigates the Pink City of his childhood. Power and money still move seamlessly among the wealthy class, and favors flow from Jaipur’s Royal Palace, but only if certain secrets remain buried. When the cinema’s balcony tragically collapses on opening night, blame is placed where it is convenient. But Malik suspects something far darker and sets out to uncover the truth. As a former street child, he always knew to keep his own counsel; it’s a lesson that will serve him as he untangles a web of lies.nnIn New York Times bestselling author Alka Joshi’s intriguing new novel, henna artist Lakshmi arranges for her protégé, Malik, to intern at the Jaipur Palace in this tale rich in character, atmosphere, and lavish storytelling.'",Historical Fiction
/book/show/50265329-the-book-of-two-ways,The Book of Two Ways,Jodi_Picoult,3.65,"59,675",2020,"""Everything changes in a single moment for Dawn Edelstein. She's on a plane when the flight attendant makes an announcement: prepare for a crash landing. She braces herself as thoughts flash through her mind. The shocking thing is, the thoughts are not of her husband, but a man she last saw fifteen years ago: Wyatt Armstrong.nnDawn, miraculously, survives the crash, but so do all the doubts that have suddenly been raised. She has led a good life. Back in Boston, there is her husband, Brian, her beloved daughter, and her work as a death doula, where she helps ease the transition between life and death for patients in hospice.nnBut somewhere in Egypt is Wyatt Armstrong, who works as an archaeologist unearthing ancient burial sites, a job she once studied for, but was forced to abandon when life suddenly intervened. And now, when it seems that fate is offering her second chances, she is not as sure of the choice she once made.nnAfter the crash landing, the airline ensures the survivors are seen by a doctor, then offers transportation wherever they want to go. The obvious option for Dawn is to continue down the path she is on and go home to her family. The other is to return to the archaeological site she left years before, reconnect with Wyatt and their unresolved history, and maybe even complete her research on The Book of Two Ways--the first known map of the afterlife. nnAs the story unfolds, Dawn's two possible futures unspool side by side, as do the secrets and doubts long buried beside them. Dawn must confront the questions she's never truly asked: What does a life well-lived look like? When we leave this earth, what do we leave behind? Do we make choices...or do our choices make us? And who would you be, if you hadn't turned out to be the person you are right now?""",Historical Fiction
/book/show/56755721-what-s-left-unsaid,What's Left Unsaid,Emily_Bleeker,4.15,"7,694",2021,"'An enthralling novel of secrets, second chances, and confronting the past by the Wall Street Journal bestselling author of When I’m Gone.nnAfter a series of devastating losses, Chicago journalist Hannah Williamson has landed in Senatobia, Mississippi, to care for her bedridden grandmother and endure grunt work at a small newspaper. But in cleaning out its archives, Hannah discovers a compelling distraction from her life: a series of rejected articles from the 1930s that illuminate a long-hidden mystery.nnThe articles, penned by a young woman named Evelyn, are haunting accounts of first love, trauma, and surviving a mysterious shooting that left Evelyn paralyzed at the age of fourteen. The articles stir up more questions than answers, and Hannah becomes consumed by what’s left unsaid. Encouraged by Guy Franklin, a local middle school teacher, Hannah’s investigation into Evelyn’s past becomes more personal with each new reveal. For Hannah, as both a journalist and a woman bearing her own emotional wounds, this is a chance to move forward and bring closure to the story of the girl whose secrets are buried in Senatobia.nnWhat Hannah’s about to discover next is that, even after nearly a century, the truth she’s been looking for still has the power to change lives. Especially her own.'",Historical Fiction
/book/show/32487617-beneath-a-scarlet-sky,Beneath a Scarlet Sky,Mark_T_Sullivan,4.41,"284,582",2017,"'n  Based on the true story of a forgotten hero, Beneath a Scarlet Sky is the triumphant, epic tale of one young man’s incredible courage and resilience during one of history’s darkest hours.nPino Lella wants nothing to do with the war or the Nazis. He’s a normal Italian teenager—obsessed with music, food, and girls—but his days of innocence are numbered. When his family home in Milan is destroyed by Allied bombs, Pino joins an underground railroad helping Jews escape over the Alps, and falls for Anna, a beautiful widow six years his senior.In an attempt to protect him, Pino’s parents force him to enlist as a German soldier—a move they think will keep him out of combat. But after Pino is injured, he is recruited at the tender age of eighteen to become the personal driver for Adolf Hitler’s left hand in Italy, General Hans Leyers, one of the Third Reich’s most mysterious and powerful commanders.Now, with the opportunity to spy for the Allies inside the German High Command, Pino endures the horrors of the war and the Nazi occupation by fighting in secret, his courage bolstered by his love for Anna and for the life he dreams they will one day share.Fans of All the Light We Cannot See, The Nightingale, and Unbroken will enjoy this riveting saga of history, suspense, and love.'",Historical Fiction
